排行,标题,封面,描述,发行年份,类型,主演,评分,评价人数
宁安如梦, 古装 爱情 ,https://pic2.iqiyipic.com/image/20231117/f4/fc/a_100508969_m_601_m29.jpg,2023 ,姜雪宁（白鹿饰）曾费尽心机当上皇后，却在宫变中被逼自杀。现在，姜雪宁的梦想就是远离权力，主宰自己的人生。可阴差阳错她还是入宫做了伴读，成为帝师谢危（张凌赫饰）的学生，姜雪宁一边接受谢危的教导，一边暗暗筹谋，想要阻止青梅竹马燕临（周峻纬饰）即将面临的“血冠礼”事件。经过姜雪宁和谢危的运筹帷幄，燕家满门性命得保。血冠礼风波后，姜雪宁无意间卷入了朝廷剿灭平南王乱党的计划，与白月光张遮（王星越饰）一起深入敌营，危急关头姜雪宁以身为张遮挡箭，但二人白瓶有隙，终是无法相守。敌国大月来犯，长公主沈芷衣（刘些宁饰）毅然踏上和亲之路。姜雪宁为解救好友沈芷衣随谢危北上讨伐大月，重重危机中谢危为保护姜雪宁甚至不惜伤害自己，二人日渐生情。然更大的阴谋逐渐浮出水面，竟直指二十年前平南王事件的真相。最终姜雪宁与谢危联手揭开了当年真相，姜雪宁也用爱感化了谢危，二人终成眷属。
无所畏惧, 都市 励志 ,https://pic9.iqiyipic.com/image/20231117/c3/f8/a_100536501_m_601_m25.jpg,2023 ,罗英子做梦也没想到，顺风顺水二十八年的她，竟然翻到了阴沟里。这天是丈夫刘铭的三十岁生日，自己的律师资格证又考到了手，本以为是个好日子，她精心准备了一桌饭菜，却在家中枯等了一夜，刘铭走了，丢弃了一切往日恩情，挽着她的闺蜜温莉出了国，还卷走了所有夫妻共同财产，只给罗英子留下了一屁股还不完的巨额债务。刘铭的背叛像一块重石，顷刻间将罗英子美好的生活砸得粉碎，她紧紧拽住唯一的救命稻草，刚刚到手的律师资格证，孤身进入良诚律所，成为一名新人律师，在阻碍重重的道路上勇敢前行。
我要逆风去, 爱情 都市 ,https://pic6.iqiyipic.com/image/20231113/c0/55/a_100487710_m_601_m20.jpg,2023 ,自香港投行跳槽回内地投资公司发展的投资人徐斯，结识了国牌服装集团董事长独生女江湖，二人因商业理念不同而互不对盘。江湖父亲的企业突然破产，江湖一夜之间由云端跌落谷底。而一直颇有事业野心的徐斯对江湖父亲曾经一手打造的胶底鞋品牌“腾岳”势在必得，使得落魄的江湖决定不惜一切保住“腾岳”。经一番周旋较量，最终徐斯与江湖立下是否能够复兴“腾岳”的存亡生死契……
田耕纪, 爱情 古装 ,https://pic6.iqiyipic.com/image/20231113/12/98/a_100522244_m_601_m16.jpg,2023 ,现代姑娘连蔓儿乱入古代农村，遇见极品的一大家子连家亲戚，后又遇见身份神秘的“傲娇”男主沈诺，二人携手斗极品亲戚，种田经营，发家致富，也渐渐相知相爱，相约相伴到老……鸡飞狗跳，串亲收稻，各位看官来都来了，那就一起种田吧。
莲花楼, 古装 武侠 ,https://pic9.iqiyipic.com/image/20231110/e5/43/a_100517696_m_601_m33.jpg,2023 ,该剧讲述了闻名武林的四顾门门主李相夷在一次大战后身受重伤，从此退隐江湖成为淡泊名利的“假神医”李莲花，在遇到新交方多病与旧敌笛飞声后重新卷入江湖的故事。江湖暗流涌动，疑团扑朔迷离，抽丝剥茧方能断出真相，一段荡气回肠的侠义情即将热血展开。
宣判, 罪案 都市 ,https://pic2.iqiyipic.com/image/20231110/8b/05/a_100547821_m_601_m8.jpg,2023 ,该剧讲述了齐州市中级人民法院新任副院长齐衡秉承“公平公正至上”的法律原则，以对社会极端 负责的态度，以“渔船杀人案”为切入点，在公安机关和检察机关的配合下，排除 了该市穷凶极恶的商人罗怀功等人的压力和干扰，公正地判决了一系列错综复杂的 案件，在判案的过程中，齐衡以高尚的品格以及深沉的关爱感染了内弟郭伦，解开了 当年因为秉公执法而送内弟入狱的兄弟心结，并且在郭伦的帮助下，结合“渔船杀 人案”、“姜县化工厂污染案”的调查基础，一步步查清了五年前妻子郭念失踪的 真相，将所有犯罪嫌疑人绳之以法的故事。该剧旨在让当今的国人了解我国的司法体 系和法制观念，增强法治自信和文化自信。它主要展现了我们近几十年来司法改革取 得的巨大进步，歌颂了人民法官的秉公执法、刚正不阿，更强调了任何资本势力妄图 绑架社会、绑架法律的企图都是行不通的，都会遭到正义、正直的法官群体利用法律 武器进行的抵制和审判。法官们不会被腐蚀、不会被绑架，他们会坚定不移地维护法 律的尊严和纯洁。
云之羽, 古装 爱情 ,https://pic3.iqiyipic.com/image/20231109/d4/64/a_100544063_m_601_m27.jpg,2023 ,宫门选亲大典在即，无锋刺客云为衫（虞书欣饰）借此混入宫门探查情报，谁知宫门之主和原定继承人宫唤羽却突遭刺客杀害，向来被排斥的四公子宫子羽（张凌赫饰）一夜之间成为了宫门之主。变故之下，云为衫只能将攻略对象重新锁定为新宫主宫子羽，一番设计后，她如愿成为宫子羽的新娘，她原以为只要成为宫主新娘便能完成任务获得自由，谁知等待她的却是更加危险的挑战，而她唯一能够利用的，只有那个看起来不学无术被迫成为宫主的宫子羽……阴谋与阳谋齐飞的江湖恩仇录，一场关于爱与信仰的成长之旅。
狂飙, 罪案 警匪 ,https://pic0.iqiyipic.com/image/20231113/8b/04/a_100476174_m_601_m44.jpg,2023 ,由金牌导演徐纪周执导，张译、张颂文、李一桐、张志坚、吴刚领衔主演，倪大红、韩童生、李建义特邀主演的中央政法委重点项目。一部扫黑除恶坚决斗争的回忆录，横跨20年的群像叙事全景式展现时代变迁下的黑白较量与复杂人性。
我的助理不简单, 励志 都市 ,https://pic1.iqiyipic.com/image/20231116/8b/ed/a_100546375_m_601_m22.jpg,2023 ,33号工作室创始人姜甜，离家去北京做一名室内设计师，一股劲地想攒钱买房，经营感情。当所有的一切都在往憧憬的方向发展时，姜甜却因得罪了公司领导而被调任到家乡的分公司，不得不与男友方元清分隔两地。但回到家中却发现父亲姜建国已经把家中的老宅租给了离婚回乡的孤寡老人吴敬芳，姜甜催搬不成只能成为合租室友，分公司的职场环境与姜甜的想象相去甚远，意外之下六十岁的吴敬芳成为她的助理。姜甜回京的计划因与男友分手而被打断，还为此丢了工作。面对失业失恋的双重打击，吴敬芳带姜甜一步步走出颓丧的日子，她成为了姜甜的助理。而姜甜也在吴敬芳的影响下找到个人发展及融入家乡的方式，吴敬芳也在姜甜的帮助下发现了自己全新的价值和可能性，重新融入竞争激烈的社会。两人在一次次的挫折中建立起深厚的战友情，在帮助别人建造理想中的家的同时，也坚定了各自未来要走的道路。
珠江人家, 战争 近代 ,https://pic6.iqiyipic.com/image/20231117/31/73/a_100546932_m_601_m6.jpg,2023 ,故事以1927年大革命失败开篇，讲述了佛山共产党员陈氏夫妇为掩护同志而惨遭杀害，他们的孩子老大陈山河、老二陈青卫以及幼女陈立夏也因此天各一方的传奇故事。多年后兄妹三人分别在粤药、粤菜、粤剧方面各有所成，扬名广州。因缘际会下，骨肉终得团聚。国难当头之际，兄妹三人恪守本心，用一腔热血谱写出抗日风云的壮丽篇章。
梅花红桃, 悬疑 年代 ,https://pic0.iqiyipic.com/image/20231110/b0/03/a_100546374_m_601_m13.jpg,2023 ,1940年的上海，代号“梅花四”的中共地下党员陈家平执行任务时，在险些暴露的紧急关头，与曾经的未婚妻左双桃偶遇。此时的左双桃已经是国民党军统特工，执行刺杀任务失败，也在寻找脱困办法。彼此不知道对方特工身份的两人，凭借当年的默契应对日本人的严密盘查，最终以情侣身份惊险过关。日本人出于对两人伪装情侣的怀疑，随即逼迫两人结婚，左双桃也将计就计进入商行工作。此后陈家平一边完成任务，一边应对未能消除的身份危机，还要一边试探左双桃的真实身份！斗争日益残酷，最终家平发现双桃是军统特工“红桃五”，左双桃也发现了家平是中共特工“梅花四”。左双桃通过对两党抗日态度与贡献的深入了解，在共产主义信仰的感召下，最终选择和陈家平一起战斗。他们历经考验，在党组织领导下完成艰巨的任务，一起踏上新的征程。
卿卿日常, 古装 喜剧 ,https://pic1.iqiyipic.com/image/20231110/ab/2d/a_100517625_m_601_m30.jpg,2022 ,因为一场联姻擢选，来自天南海北的女孩们齐聚新川。韬光养晦的新川六少主尹峥，与只想努力落选、在老家安逸度日的李薇意外结缘，共同开启了一段状况百出却又相映成趣的新生活。随着尹峥开府、上朝，二人逐渐口味相投、心意相通，携手共度三餐四季，并与其他性格命运各异的兄弟姐妹们相伴成长，一起书写着新川大家庭的温暖日常。
长风渡, 古装 爱情 ,https://pic3.iqiyipic.com/image/20231110/2f/ed/a_100521679_m_601_m39.jpg,2023 ,布商之女柳玉茹自小遭遇生母病重、庶母不慈、父亲不重视的困境。为求改变命运，她战战兢兢做了十几年模范闺秀，唯求嫁个好人家，不料在订婚前夕被逼嫁给了纨绔子弟顾九思。顾九思误会柳玉茹是因贪慕顾家钱财而设计嫁给自己，扬言休妻，更在新婚之夜遁入酒楼。柳玉茹这才明白将命运系之婚姻、他人实如无本之水，故决定抛开过往伪装，真实、独立而精彩地实现自我。她一方面随顾母学习经商，另一方面则逼顾九思戒赌、读书。顾九思也在此过程中逐渐显示出独到的眼光与智慧，以及至纯至善的一面，两颗心愈靠愈近。
他从火光中走来, 都市 爱情 ,https://pic9.iqiyipic.com/image/20231109/f1/f4/a_100535261_m_601_m30.jpg,2023 ,该剧讲述了新时代消防人员在应急消防救援工作中的日常与成长，展现了消防勇士们的忠诚、坚守、热血与牺牲。林陆骁与南初这对“火光CP”，面对重重考验初心不改，为誓言坚守，为梦想奋进，势均力敌的不仅是爱情，更是勇气与承担。
庆余年, 古装 剧情 ,https://pic1.iqiyipic.com/image/20231109/cc/ed/a_100142164_m_601_m25.jpg,2019 ,范闲15岁起，跟随毒高手费介学习武艺与毒术，四年后武力上乘。一场投毒事件揭开序幕，范闲踏上京都之旅，结识柳如玉、范思辙等人，与林婉儿一见钟情。然而，平静生活被一场围杀打破，滕梓荆为救范闲而死。范闲感受世间冷暖，决心改变世界。在正义伙伴们的支持下，范闲历经艰险，坚守赤子之心，勇往直前。
请回答1988, 都市 家庭 ,https://pic9.iqiyipic.com/image/20231110/96/e6/a_100018575_m_601_m17.jpg,2016 ,五个生于1971年的好友德善、善宇、东龙、崔泽、正焕，在首尔道峰区双门洞共度青春岁月。1988年，他们迎来18岁的花季，共同见证了汉城奥运会、柏林墙倒塌等历史事件。他们有着共同的兴趣、崇拜的偶像，还有暧昧的男女情愫。在那个纯真年代，他们谱写了许多美好回忆，成为今天生活的基石。
拆案：黎明将至, 悬疑 惊悚 ,https://pic2.iqiyipic.com/image/20231117/ac/c0/a_100546617_m_601_m19.jpg,2023 ,在上海法租界巡捕房内，法医车素薇（董璇饰）与巡铺房总巡顾远（谷嘉诚饰）协力侦破以五行衍生出的七个惊悚迷案。案件利用中国传统文化，预测和揣度民国时期犯罪者的心理，每个故事情节跌宕起伏，迷雾重重，而其背后隐喻的人性，更是让人唏嘘嗟叹。
琅琊榜, 古装 宫廷 ,https://pic1.iqiyipic.com/image/20231110/38/72/a_100006840_m_601_m24.jpg,2015 ,《琅琊榜》是根据海宴同名小说改编的大型古装传奇电视剧。该剧以平反冤案、扶持明君、振兴山河为主线，讲述了“麒麟才子”梅长苏才冠绝伦、以病弱之躯拨开重重迷雾、智博奸佞，为昭雪多年冤案、扶持新君所进行的一系列斗争。梅长苏在国仇家恨、兄弟情义的漩涡中见招拆招、游刃有余，奏出了“江左梅郎”赤子之心下的一曲慷慨悲歌。
周生如故, 古装 爱情 ,https://pic8.iqiyipic.com/image/20231109/98/6f/a_100447462_m_601_m19.jpg,2021 ,年少成名、战功赫赫的小南辰王周生辰，立志一生效忠国家，其严谨作风和谦逊为人为世人所称道。名门漼氏独女漼时宜出生便被指腹为婚为未来太子妃，因与王府是世交，便被长辈送到王府学艺。漼时宜善良可爱、活泼聪慧的个性，在王府深得众人喜爱，学艺精进也很快，是王府的开心果。点滴相处中，漼时宜钦佩周生辰远大的志向和儒雅的品格，不知不觉中爱上了这位将军。无论是守在王府等待捷报，还是与周生辰并肩作战，漼时宜都是周生辰最坚强的后盾和最温暖的支撑。两人情感迅速升温，但依然发乎情止乎礼。
虎鹤妖师录, 古装 自制 ,https://pic8.iqiyipic.com/image/20231113/35/08/a_100506589_m_601_m16.jpg,2023 ,500年前的东方大陆，妖邪作祟，民不聊生，正义之士祁无极带领一众妖师，在巅峰谷斩杀妖帝，还世间安宁。但妖帝之血却化成业火冥海，将大陆分成了伏龙、千羽和巨轮三国，妖师们用赤珠组成结界以护卫大陆生灵。然而，500年的平静一夕之间却因一颗赤珠的损坏被打破。伏龙国派出少年妖师祁晓轩寻找新的赤珠代替，赤珠却被一山野小痞虎子所盗并意外吞下，二人命运就此缠绕。从不甚愉悦的萍水一遇、一冷一热的性情相左，到除妖之战中的舍身相救、抛开偏见后的彼此了解。虎子因体内妖力饱受争议，晓轩为维护虎子不惜忤逆父亲，但在国御妖师比赛的关键时刻，晓轩却因体内“双生元神”的诅咒对虎子刀剑相逼。经历过决裂的至暗时刻，再到追踪疑案、斩妖除魔时的再次聚首，误会在默契中消解，友谊的力量更加炽烈。伏龙危机、千羽劫难、巅峰之战，一系列疑团接踵而至，一个个艰难时刻携手共渡，而这背后似乎总有一双无形之手。
知否知否应是绿肥红瘦, 古装 爱情 ,https://pic0.iqiyipic.com/image/20231109/ea/a9/a_100233926_m_601_m11.jpg,2018 ,盛家六姑娘明兰从小聪颖貌美，却遭遇嫡母不慈，姐妹难缠，父亲不重视，生母被害去世的困境。她藏起聪慧，掩埋锋芒，忍辱负重逆境成长，在万般打压之下依然自立自强，终历尽艰难为母报仇。在这一过程中，明兰结识了宁远侯府二公子顾廷烨。顾廷烨帮过明兰，也刻薄过明兰，他见过明兰软糯表皮下的聪慧锐利，也见过她刚强性格中的脆弱孤单，对她早已倾心。朝廷风云变幻，在顾廷烨的拥戴下，赵家旁支宗室子弟被立为太子，顾廷烨拿着勤王诏书，大破反贼，而后拥立新帝，成为新朝第一功臣，略施巧计娶了明兰为妻。明兰婚后管家业、整侯府、铲奸佞、除宵小，夫妻二人解除误会建立了深厚的感情，最终明兰与丈夫一同协助明君巩固政权，二人也收获了美满的人生。
苍兰诀, 爱情 奇幻 ,https://pic8.iqiyipic.com/image/20231110/64/e6/a_100447503_m_601_m16.jpg,2022 ,讲述息兰一族被灭族，神女万年后重生成天界低阶仙女小兰花，无意间复活了困于昊天塔的月尊。为获得自由，东方青苍要牺牲小兰花的神女之魂解开身上咒术封印，在此过程中，这个断情绝爱的东方青苍却爱上了温顺可爱小精怪。
一生一世, 偶像 爱情 ,https://pic0.iqiyipic.com/image/20231110/9f/30/a_100447497_m_601_m9.jpg,2021 ,温婉可人、处事低调的业内顶尖配音演员时宜，一日在机场偶遇了儒雅的海归化学教授周生辰，两人一见如故颇有眼缘，短暂交往后彼此都留下了深刻印象。为了拯救日渐没落的紫砂壶工厂，周生辰答应母亲的条件，订婚承业。他婉拒了家里安排，向颇有好感的时宜提出了订婚的请求。时宜内心早已认定，欣然答应。点滴相处中，两人默契逐渐产生，两颗心慢慢靠近。周生辰为了振兴家乡的紫砂壶工艺，与长辈产生了经营理念上的巨大分歧，面对亲情和事业的两难境地，幸得时宜始终相伴，并给予了最坚实的支持和鼓励，两人最终携手最大程度地保全了传统手工艺。风雨过后，情意更为深重。
武林外传, 古装 喜剧 ,https://pic5.iqiyipic.com/image/20231109/65/80/a_50133980_m_601_m15.jpg,2006 ,国内情景喜剧的巅峰之作，一举捧红沙溢，闫妮，姚晨等明星，人物形象各个生动，每集笑点让人捧腹大笑不止。故事讲述了以掌柜的佟湘玉(抠门之极的女店主，风情万种但心地善良，婆婆妈妈又十分鸡贼。)为首的一个客栈班底，这其中有跑堂的白展堂(会点穴、有武功，是个盗贼，想改过自新，其实胆小如鼠)，有打杂的郭芙蓉(她自恃有武功，乱闯江湖，喜欢动手动脚，虽为大侠千金，其实武功不咋的，是个标准的野蛮女友)，有厨子李大嘴(成天幻想学武功当大侠，就是不好好做饭，做出的饭难吃死了)，会算账的吕秀才(常常是子曰不离口，其实是个百无一用的书生，手无缚鸡之力却歪打正着地混来一个“关中大侠”的称号)，有寄宿客栈的祝无双(虽为葵花派武林高手，其实是个常受欺负的弱女子，美丽却没有爱情光顾)，有顽皮少女莫小贝(江湖上传闻是个女魔头，实际上是个爱逃学并且只想吃糖葫芦的小丫头片子)，还有两位捕快，一个老邢，一个小六，每天吵吵着破大案子，其实是俩混日子的糊涂蛋。
人世间, 家庭 生活 ,https://pic8.iqiyipic.com/image/20231110/86/68/a_100480805_m_601_m10.jpg,2022 ,该剧根据梁晓声的同名小说改编，以居住在北方某省会城市的一户周姓人家三代人的视角，描绘了十几位平民子弟在近50年时间内所经历的跌宕起伏的人生，全面展示了改革开放以来中国所经历的翻天覆地的社会巨变，歌颂了中国人民拼搏向上、艰苦奋斗的伟大历程，以及勤劳正直、自尊自强的美好内心。
特工任务, 都市 谍战 ,https://pic1.iqiyipic.com/image/20231109/c4/6c/a_100502494_m_601_m18.jpg,2023 ,2021年中国津海，一款名为“特工任务”的游戏正在年轻人中盛行。 谁也无从知晓，这款游戏竟出自境外情报组织“夜雾”之手。“夜雾”利 用游戏玩家在未知情况下暗中开展间谍活动，并借机在玩家之中发展可利 用的间谍，游戏的恶种正悄无声息的在津海市蔓延。 此时，津海市国安局侦察科科长高天阳，与潜伏在特工游戏中的情报 人员吴熙互相配合，深入游戏调查一起实验室机密失窃案。二人在调查的 过程中，发现与高天阳一起长大的弟弟黄子诚竟也深陷特工游戏之中。高 天阳吴熙成功挽救了身陷间谍阴谋的黄子诚，黄子诚也凭借着在特工游戏 中的丰富经验，成为了国安局的线人。 黄子诚在游戏的过程中，邂逅了搭档姚瑶，两人共同度过一段惊心动 魄的游戏之旅。正当黄子诚情愫渐生之时，意外发现自己和姚瑶的偶遇， 从始至终就是一场骗局，姚瑶竟是间谍拉他下水的诱饵。游戏的残酷性， 一步步显现在众人的面前。
唐朝诡事录, 古装 悬疑 ,https://pic9.iqiyipic.com/image/20231110/6f/7d/a_100443951_m_601_m19.jpg,2022 ,该剧改编自作家魏风华同名原著，讲述了在繁华的大唐盛世之下发生的一系列奇闻异事，长安金吾卫中郎将卢凌风将与狄公亲传弟子苏无名携手共破诡案，守护苍生，担负起挽救社稷于危急的使命。
反骗警察, 警匪 犯罪 ,https://pic8.iqiyipic.com/image/20231110/e1/b0/a_100545843_m_601_m19.jpg,2023 ,"本剧讲述中州新警高仁，阴差阳错卧底电信诈骗团伙，协助市局破获特大刑事案件的故事。警校毕业班学生高仁，车站长大，随师父知晓“正提反脱、风火除谣”千门八将，了解哄骗、婚骗、谎骗、诨骗、诳骗、坑骗、串骗、局骗、拐骗等各种骗术，是警界反诈骗的苗子。
班长姐安玲玲闺蜜遭遇杀猪盘，高仁带领警校反骗五人组和混混李小拐等多次交锋获胜，诈骗头目蒋爷对他又爱又恨。市局领导识人善任，队长邹蕾化妆富婆协助高仁，成功卧底诈骗团伙，以身犯险帮助市局，掌握了团伙校园贷、套路贷、零元购、虚拟货币投资、赌博设局、冒充公检法、刷卡消费等诈骗动向，获取了关键证据，堵截了赃款，最终破局，成功捣毁这个隐藏中州市数十年的诈骗团伙。"
雾中系铃人, 犯罪 警匪 ,https://pic4.iqiyipic.com/image/20231109/ce/1a/a_100546594_m_601_m11.jpg,2023 ,毒枭“飞鹰”突然现身临江市并利用精密设计摆脱公安机关围捕。青年刑侦专家鲁江奉命侦破此案，却被一系列事件推入迷局。临江徐、潘两大家族企业一向不合，潘越阳是鲁江亲舅舅，一直希望鲁江和养女苏潘结婚，于此同时鲁江和本市另一家族集团徐克己的女儿徐佳音产生情感纠葛，最终鲁江凭借自己的毅力和智慧，冷静分析案情，渐渐识破“飞鹰”到底是谁，并在缉毒队副队长戴志勇和禁毒支队同志们的通力协作下打掉飞鹰集团，整个城市也最终恢复了祥和和安定。
消失的痕迹, 悬疑 罪案 ,https://pic3.iqiyipic.com/image/20231109/f2/a5/a_100537917_m_601_m20.jpg,2023 ,"该剧讲述了天才女法医谷雨潜入精神疗养院执行伪装侦查任务，不料卧底计划被一起凶杀案破坏，甚至险些被诬陷成为凶手，也因此谷雨结识了女刑警白鹭的故事。两人的性格水火不容，生活习惯也大不相同，但这个神奇的组合，却屡破奇案，她们从最初的互相对抗到彼此协助，建立了深厚的友谊。
在谷雨和白鹭侦破的一起刑事案件过程中，她们意外发现了失踪的谷雨哥哥的踪迹。而谷雨哥哥的失踪又和白鹭战友的殉职有着千丝万缕的联系，这一切都指向境外制毒团伙。二人的命运被她们牵挂着的人紧紧连接在了一起，她们有着共同的目标——找到一切罪恶的源头。她们坚信痕迹之下，必有真相。"
半是蜜糖半是伤, 青春 偶像 ,https://pic0.iqiyipic.com/image/20231110/a3/68/a_100396683_m_601_m16.jpg,2020 ,江君，一个对眼泪重度过敏的女孩，有着经济学与心理学双硕士学位，父母给予的优越而宠溺环境造就了她天性洒脱、理想主义的性格，毕业后的她在一家公益组织工作，追寻着属于自己内心的生活。不料，父亲的意外去世却使她站在了人生的三叉路口，江君最终决定进入顶级投行公司MH完成父亲的遗愿。在MH里，江君意外与童年玩伴袁帅相逢，但高兴不过三秒后，却发现自己童年的保护伞，那个温柔的袁帅哥哥竟然处处与自己为敌，在狼性文化的投行公司里，有人在暗中给她布局设套，有人视她为棋子兼眼中钉，但江君凭借着自己善良而细腻的天性，出众的情商以及天才般的想象力，判断着人和项目复杂的变数，在暴风雨的中心，她开始了自己的征途，经历了一番番风霜雪雨后，最终收获了自己的事业与爱情。
终极笔记, 奇幻 青春 ,https://pic2.iqiyipic.com/image/20231109/d1/55/a_100431434_m_601_m14.jpg,2020 ,原本只对三叔经历感兴趣的吴邪历险归来后收到神秘录像带，发觉自己被卷入一场阴谋中。他只身探险格尔木疗养院，偶遇张起灵等人，组成六人小队结伴而行。在西王母宫中意外发现神秘陨玉，却不想此时三叔突然失踪、张起灵失忆；为帮助张起灵寻回记忆，众人一路探索，发现张家古楼正是关键所在，却因为裘德考势力的介入不得而终。霍老太突然出面与吴邪等人联手，复制当年九门的联合行动再次去张家古楼探寻真相，不料在行动中突发意外，众人陷入危机。至此谜团未解，各方势力失衡，吴邪被迫戴上面具伪装成三叔。
