排行,标题,封面,描述,发行年份,类型,主演,评分,评价人数
琅琊榜之风起长林, 古装 偶像 ,https://pic9.iqiyipic.com/image/20231109/af/ad/a_100035374_m_601_m17.jpg,2017 ,大梁朝局安稳，但边境战火不断，守护大梁北境的长林军屡获军功，长林王萧庭生父子三人却遭群臣恶意揣测，被指权倾朝野、功高盖主，针对长林王府的阴谋逐渐展开。面对内忧外患，长林世子萧平章及二公子萧平旌外抗强敌征战北境血洒沙场、内斗奸佞起兵勤王营救梁帝，家国情、父子情、夫妻情、兄弟情热血浇筑长林风骨。
骄阳伴我, 爱情 都市 ,https://pic6.iqiyipic.com/image/20231110/a7/ac/a_100528398_m_601_m18.jpg,2023 ,努力打拼的新人设计师盛阳和业内知名的广告导演简冰偶遇结缘，从此展开了一段彼此照耀、相互治愈的“充电式爱情”故事。盛阳在简冰的启发和鼓励下不断成长，并在行业中崭露锋芒，而简冰则在盛阳的关心与陪伴下，重拾对生活与爱情的信心。
我的团长我的团, 战争 文学改编 ,https://pic1.iqiyipic.com/image/20231110/58/62/a_50119243_m_601_m18.jpg,2009 ,在禅达这个战火纷飞的边境小镇，一群来自五湖四海的溃兵和百姓因命运相聚。他们摒弃前仇恩怨，组成一支小分队，为民族存亡而战。在严酷的战争环境中，他们勇敢面对日本侵略者，誓死捍卫家园尊严，谱写了一曲曲铁血卫国的悲壮战歌。
花溪记, 古装 爱情 ,https://pic1.iqiyipic.com/image/20231110/29/b1/a_100457486_m_601_m12.jpg,2023 ,戏精少女李初月意外进入云蔚山庄，却被迫配合少庄主安景昭假扮未婚夫妻掩人耳目，两人在携手应对山庄危机中渐生情愫，而幕后黑手逐渐浮出水面的故事。
女子特战队, 战争 谍战 ,https://pic5.iqiyipic.com/image/20231110/92/34/a_100088147_m_601_m10.jpg,2016 ,1945年春，日军第四宪兵团所属的“南木部队”押送日军之重宝“茹莎”经过哈达河地区，中共组织当地游击人员中途拦截。不料关东军防守严密，游击小队遭遇重创，队长孟虹跳崖失忆，惨被俘获。“茹莎”更是不知所踪。我党紧急召回孟虹的丈夫山鹰，联合老党员关林，组织人员成立特战队，营救孟虹，夺回“茹莎”。怎料集结而来的特战队成员，竟是清一色的娘子军，尽管各个身怀绝技，却不擅协作，一时间难以团结。关东军组织“特搜班”，对共产党地下组织搜捕杀戮，掀起了一阵血雨腥风。女子特战队的成员们在和日军一次次的殊死搏斗中，逐渐形成默契，层层粉碎敌人的阴谋，救出孟虹，唤醒了她的记忆。在孟虹的带领下，女子特战队肃清了队伍，揪出日本间谍，最终消灭部队，并将“茹莎”情报交付抗联上级。
爱上特种兵, 军旅 自制 ,https://pic7.iqiyipic.com/image/20231109/96/2e/a_100381426_m_601_m15.jpg,2021 ,刚结束军医大八年学医生涯的夏初在成为住院医的第一年，便跟随东南战区总医院联合医疗驻队来到充满异域风情的伊萨亚小镇，与刚结束猎人学校课程的东南战区特种大队梁牧泽初相遇便结下梁子。回国后，机缘巧合之下，夏初与梁牧泽开始了一段温情与互黑齐飞的同居生活。经历着日常的鸡毛蒜皮，也经历了军演、抗洪的生离死别之后，两人情愫暗生。但与此同时，初恋卓然突然以海归企业家的身份出现。梁牧泽敏锐地捕捉到他身上的危险气息，爱人的情感与安全都遭受威胁，他隐忍地担当，在关键时刻果断出击。梁牧泽既完美地完成了军人的使命，也保护了爱人的安全。夏初也解开了过去的心结，看清了自己的情感诉求。
西游记, 古装 神话 ,https://pic3.iqiyipic.com/image/20231109/86/46/a_50117380_m_601_m20.jpg,1986 ,该剧讲述的是孙悟空、猪八戒、沙僧辅保大唐高僧玄奘去西天取经，师徒四人一路抢滩涉险，降妖伏怪，历经八十一难，取回真经，终成正果的故事。
理想之城, 都市 励志 ,https://pic5.iqiyipic.com/image/20231113/ab/ba/a_100420992_m_601_m11.jpg,2021 ,《理想之城》是由刘进执导，孙俪、赵又廷领衔主演，于和伟特邀主演，陈明昊、高叶、李传缨、张澍、李洪涛、赵君、钱漪、刘泊霄主演，杨超越、刘奕畅特别主演的都市职场剧。该剧根据若花燃燃的小说《苏筱的战争》改编，讲述了造价师苏筱的成长之路，并反映中国建筑行业现状。
宸汐缘, 古装 仙侠 ,https://pic6.iqiyipic.com/image/20231109/16/a7/a_100281217_m_601_m38.jpg,2019 ,该剧讲述了肩负守护六界苍生之责的九宸和灵汐相遇相爱，为坚守职责、守护爱人而经历几重辗转悲欢，一诺苍生、挚爱情深的极美爱情故事。
北辙南辕, 都市 爱情 ,https://pic6.iqiyipic.com/image/20231110/d6/3b/a_100441640_m_601_m13.jpg,2021 ,该剧讲述五个女性在携手创立“北辙南辕”餐厅的过程中，收获成长与爱情的故事。
天道, 都市 爱情 ,https://pic0.iqiyipic.com/image/20231109/ec/f4/a_100009682_m_601_m11.jpg,2006 ,女警官芮小丹（左小青 饰）受托照料商界怪才丁元英（王志文 饰）的生活，二人因共同热爱音乐而坠入爱河。丁元英答应帮助芮小丹的农村老家脱贫，用智慧谱写神话。在音响市场掀起巨变的同时，他们演绎了天道的“道法自然，如来”。然而，丁元英的礼物完成之际，一切并非想象中的那么简单。
沉默的真相, 悬疑 罪案 ,https://pic7.iqiyipic.com/image/20231109/33/7f/a_100403629_m_601_m14.jpg,2020 ,"一起看似简单的自杀案, 背后隐藏着一个不可告人的巨大秘密; 为了揭开这个秘密, 一群人历经七载, 付出无数代价, 甚至赌上性命...一个曾有大好前途，四平八稳的检察官江阳，但因受贿贪污，坐牢三年，再次出现在公众视野里竟是他出现在行李箱里的蜷缩的尸体；运送他尸体的当地著名律师张超。此案引发全市关注，刑警严良介入负责此案，与张超正面交锋。张超承认犯罪，却在接受法院宣判时当场翻供，并拿出不在场证据，案件陷入死局。"
我是特种兵之利刃出鞘, 军旅 文学改编 ,https://pic7.iqiyipic.com/image/20231110/ce/ee/a_50233790_m_601_m11.jpg,2012 ,20世纪80年代后期，狼牙侦察大队狙击手何卫东为救观察手范天雷，被外号“蝎子”的敌狙击手狙杀。何卫东四岁的儿子何晨光接过了父亲血染的79式狙击步枪瞄准镜。15年后，范天雷已是狼牙特战狙击手教官，他鼓励全国青少年级别的武术冠军何晨光、颇有打枪天赋的小混混王艳兵、朴实却有超常毅力的农村少年李二牛一起参军。
锦衣之下, 爱情 古装 ,https://pic0.iqiyipic.com/image/20231109/6f/0f/a_100106079_m_601_m28.jpg,2019 ,六扇门女捕快袁今夏与锦衣卫陆绎因案结怨，却又奉命共同下扬州查找失踪的朝廷官银。从水火不容到惺惺相惜，两人命运紧密相连。然而，今夏竟是家族血仇的遗孤，与陆绎之间难以跨越的鸿沟横生。历经磨难，两人为救百姓、抗倭寇、锄奸佞，放下仇怨，勇敢走到一起。
今日宜加油, 都市 喜剧 ,https://pic4.iqiyipic.com/image/20231110/6e/01/a_100517301_m_601_m16.jpg,2023 ,企划三部曾是高发电子公司内部最神秘和风光的部门，但近三年却因屡次提出不靠谱的企划而导致地位一落千丈。但是企划三部的众人却以各自的方式，演绎着“平凡奋斗者”的生活。无论是职场“黑洞”李天然，还是追求内心平和淡然的女孩范思思，抑或是冷面热心肠的吴意美、选择奋斗不做纨绔子弟的白马帅，他们有自己的梦想、有自己的执着，也有对企划三部的深厚感情。他们和同事一起进步，陪公司一同成长。虽然面临着副董的故意挑刺、企划一部的竞争，但他们用努力一次次成功化解了危机，使企划三部重回巅峰，也让自己在笑中带泪的职场生活中成长，收获了珍贵的爱情与友情。
猎毒人, 警匪 罪案 ,https://pic4.iqiyipic.com/image/20231109/fa/57/a_100156702_m_601_m17.jpg,2018 ,高智商、高学历的化学工程师吕云鹏，只身前往西南边陲，凭借海关监控和一张快递单，历经数月摸排，锁定了杀害大哥吕云飞父子的凶手，意欲报仇。吕云飞是打入金三角贩毒组织的警察，暴露后被杀，牺牲前通过快递包裹传回情报，因手段非常，警方一直未能破解。女警江伊楠作为吕云飞的搭档和学生，赶赴明山追凶查案，行动中，不断遭遇吕云鹏的冒险行为，百般劝阻。可吕云鹏软硬不吃，且凭借超凡的化学专业知识与过人的智慧胆识，与警方同步接近着真相，甚至破译出大哥遗留密码的真实含义。
下一站婚姻, 都市 爱情 ,https://pic4.iqiyipic.com/image/20231109/41/fe/a_100011919_m_601_m9.jpg,2015 ,邓草草因孩子走失离婚独自生活，退伍特种兵龚剑成为她所住小区的保安队长。两人相识并共同寻找孩子，重逢的孩子已不再乖巧。龚剑与孩子建立特殊感情，与邓草草走向婚姻。然而，前夫复婚、女同事追求等困扰接踵而至，经历爱恨抉择后，两人再次走到一起。
促醒者, 励志 都市 ,https://pic4.iqiyipic.com/image/20231109/8c/a1/a_100459597_m_601_m15.jpg,2022 ,第九医院的神经内科主任丁学坤意外身亡，远在瑞典留学的精英西医儿子丁远志与多年在外的中医儿徒韩西林回到九院，共同调查死因真相的故事为主线，全面呈现老中青三代医护工作者“医者仁心”的精神风貌，及薪火相传中医药文化、中西医结合创新诊疗的过程中所经历的坚守与成长。
精英律师, 爱情 都市 ,https://pic0.iqiyipic.com/image/20231110/fb/aa/a_100348772_m_601_m15.jpg,2019 ,罗槟，资深律师，戴曦误入律所成为助理。二人因观念差异频繁冲突，戴曦投入工作导致恋情破裂。历经项目磨炼，戴曦逐渐尊敬罗槟，罗槟也学会关爱他人。最终，戴曦成为正义感十足的优秀律师，与罗槟成为业界公认的最佳搭档。
不完美受害人, 都市 当代 ,https://pic3.iqiyipic.com/image/20231109/a4/e7/a_100521318_m_601_m15.jpg,2023 ,该剧讲述一桩第三方匿名报警引发的神秘案件，人性、权利、欲望在探寻这场“不完美”真相过程中一一展现，一场场剧情反转、一次次叩问人心，究竟隐藏着怎样的真相。
宿命之敌, 谍战 近代 ,https://pic3.iqiyipic.com/image/20231109/b4/28/a_100534680_m_601_m13.jpg,2023 ,抗战期间，为打击汪伪政府特务组织76号，军统成立新安特训班。情胜兄弟的发小陈克海和方黎结伴前往，以期抗日救国。然而一次任务的失利却让陈、方二人天各一方。两年后，已秘密加入共产党的陈克海回到上海并潜入76号，发现方黎已经站在了自己的对立面。兄弟重逢之际亦是道路抉择之时。面对性格大变的陈克海，方黎屡次试探，甚至不惜欺瞒以确定陈克海的身份。陈克海身处敌营，虎狼环伺，面对一次次的试探与危机，他临危不惧，化险为夷，为组织输送了宝贵的情报。但他发现方黎的身份似乎也并不简单。战局的迷雾渐渐散去，这对昔日的同窗知己，为了彼此的信仰，将迎来最后的对决。
尘封十三载, 悬疑 犯罪 ,https://pic3.iqiyipic.com/image/20231113/0a/9d/a_100517610_m_601_m21.jpg,2023 ,1997年未能侦破的特殊杀人案件在13年后重现，当年一直没有追查到真凶的刑警卫峥嵘备受打击离开一线，而曾经初出茅庐的新警陆行知褪去稚嫩青涩，已成为缜密细致的刑侦能手，案件的重重巧合让师徒二人再次走到了一起，合力追缉真凶。 
请君, 爱情 奇幻 ,https://pic2.iqiyipic.com/image/20231110/31/5e/a_100489277_m_601_m24.jpg,2022 ,讲述了“千年将军”陆炎（任嘉伦饰）和“仗义女寨主”于登登（李沁饰）之间令人啼笑皆非的爱情故事。剧中有着神秘力量的陆炎阴差阳错结识了青泉寨大当家于登登，这段有着千年因缘的爱情由此展开。
神探狄仁杰第二部, 古装 悬疑 ,https://pic8.iqiyipic.com/image/20231109/28/d4/a_50231775_m_601_m14.jpg,2006 ,烽烟四起的武则天年间，王孝杰、赵文翙奉命出征御敌，却因神秘失踪导致全军覆没。狄仁杰受命察查失败原因，面临诡谲敌手和迷离案情。凭借智勇，狄仁杰拨云见日，挽救危局，成功挫败一场颠覆国家的阴谋，赢得举国赞誉。
猎罪图鉴, 悬疑 罪案 ,https://pic9.iqiyipic.com/image/20231109/ee/cb/a_100463128_m_601_m11.jpg,2022 ,该剧讲述了因一起尘封旧案而结怨的模拟画像师沈翊和刑警队长杜城，在机缘巧合下被迫搭档，两人联手侦破多起离奇疑案，共同追踪谜底真相的故事。
神勇武工队传奇, 战争 近代 ,https://pic1.iqiyipic.com/image/20231110/bf/2a/a_100133052_m_601_m3.jpg,2017 ,敌后抗日武工队是华北抗日战场上最闪亮的传奇，高风亮领导的定西县抗日武工队坚持敌后抗战，随时出击神出鬼没，如同一把尖刀插在鬼子心里，让鬼子时时心如刀绞，痛不欲生。抗战后期，鬼子进入最后的疯狂，为剿灭武工队，定西鬼子特战队队长冲田新八，多次设下圈套，敌方汉奸队、鬼子特务大队，甚至我军情报站，都成为了冲田新八的诱饵。高风亮在鬼子陷阱面前率领战士们一次次虎口脱险的同时，完成了护送首长、定点锄奸、爆破军火库等任务，给鬼子以迎头痛击。
月光变奏曲, 爱情 偶像 ,https://pic7.iqiyipic.com/image/20231109/99/72/a_100441649_m_601_m4.jpg,2021 ,新晋大神昼川一向宣称网络时代编辑已死，不料却遇到初入茅庐的灵魂捕手——元月社小编辑初礼。这个小姑娘不但怼天怼地怼大神，昼川还意外发现她居然是自己交心多年的线上网友猴子君。被书粉称为温润如玉公子川的昼川，在初礼口中却成了人前人后两副面孔的戏子老师。元气少女和戏子老师线上线下相爱相杀火花四射，携手做书，共同成长，谱写了一段有怼有甜的恋爱成长故事。
王牌部队, 军旅 自制 ,https://pic2.iqiyipic.com/image/20231110/3d/96/a_100459586_m_601_m8.jpg,2021 ,该剧以党在新形势下的强军目标为引领，聚焦锻造“召之即来、来之能战、战之必胜”精兵劲旅，展现近四十年中国军队的数次变革和军人所经历的非凡岁月，唱响一曲中国人民解放军新时期军魂的赞歌。
拆案2, 悬疑 推理 ,https://pic4.iqiyipic.com/image/20231109/44/8f/a_100465592_m_601_m11.jpg,2022 ,1930年代的上海，中国最繁华都市，十里洋场，有“东方魔都”的美称。繁华背后，隐藏着一桩桩扑朔迷离、匪夷所思的刑事案件。租界中央巡捕房内，刚刚升任督察长的顾远，在著名女法医车素薇的协助下，联手上海第一商会会长康一臣，共同侦破着光怪陆离的奇案，其中有：“沪上名媛”的下蛊虐恋；好莱坞同步上映的“吸血鬼”电影引发的吸血事件；为追求极致体验而深藏的宅门伦理；可以引发群体抑郁的杀人魔曲；校园霸凌后的“请仙”复仇；伤及“龙脉”的风水迷局；中国首场“马拉松”的惊天爆炸。这一桩桩悬案背后，隐藏的更是时代变革下彷徨迷茫的人心。最终，中央巡捕房协力铲除了隐藏于租界的敌对势力，保卫了一方国土的平安。
朱元璋, 古装 历史 ,https://pic7.iqiyipic.com/image/20231110/b0/a5/a_50263913_m_601_m14.jpg,2006 ,元朝末年，天下大乱。朱元璋自幼父母双亡，沦为乞丐，后又遁入空门。他走投无路，参加了义军，从此南征北战，一步步走上了中国历史的舞台。朱元璋心思缜密，把徐达、汤和等一批将才笼络在自己身边，对李善长、刘伯温等文人礼遇有加。在鄱阳湖大水战中，他以少胜多，一举消灭了劲敌陈友谅，创建了明朝。
小欢喜, 家庭 都市 ,https://pic0.iqiyipic.com/image/20231109/97/2f/a_100193141_m_601_m24.jpg,2019 ,北京市，三个备战高考的家庭不仅面对着升学压力，更面对着亲子关系难题。恨铁不成钢的妈妈童文洁和学渣儿子方一凡之间因为成绩矛盾重重，爸爸方圆不得不左右调停；拒绝前夫乔卫东入侵母女生活的单亲妈妈宋倩，对女儿乔英子的生活展开了全包围式关切，误解和矛盾不知不觉悄然爆发；空降父亲季胜利和妈妈刘静的突然关怀，让从小养在舅舅刘铮身边的季杨杨无所适从，父子之间小心翼翼的相处并没有为这段关系换来和平。
